{
  "schema_version": "1.0.0",
  "source": "huggingface_api",
  "generated_at_utc": "2026-02-16T04:56:57.843844+00:00",
  "model_count": 100,
  "models": [
    {
      "model_id": "Qwen/Qwen2.5-7B-Instruct",
      "pipeline_tag": "text-generation",
      "downloads": 12142981,
      "likes": 1072,
      "license": "apache-2.0",
      "context_length": null,
      "size_bucket": "7b",
      "private": false,
      "gated": false,
      "tags": [
        "transformers",
        "safetensors",
        "qwen2",
        "text-generation",
        "chat",
        "conversational",
        "en",
        "arxiv:2309.00071",
        "arxiv:2407.10671",
        "base_model:Qwen/Qwen2.5-7B",
        "base_model:finetune:Qwen/Qwen2.5-7B",
        "license:apache-2.0",
        "text-generation-inference",
        "endpoints_compatible",
        "deploy:azure",
        "region:us"
      ],
      "last_modified": "2025-01-12T02:10:10.000Z",
      "source_url": "https://huggingface.co/Qwen/Qwen2.5-7B-Instruct",
      "confidence": "vendor_listed"
    },
    {
      "model_id": "Qwen/Qwen3-0.6B",
      "pipeline_tag": "text-generation",
      "downloads": 10034367,
      "likes": 1076,
      "license": "apache-2.0",
      "context_length": null,
      "size_bucket": "other",
      "private": false,
      "gated": false,
      "tags": [
        "transformers",
        "safetensors",
        "qwen3",
        "text-generation",
        "conversational",
        "arxiv:2505.09388",
        "base_model:Qwen/Qwen3-0.6B-Base",
        "base_model:finetune:Qwen/Qwen3-0.6B-Base",
        "license:apache-2.0",
        "text-generation-inference",
        "endpoints_compatible",
        "deploy:azure",
        "region:us"
      ],
      "last_modified": "2025-07-26T03:46:27.000Z",
      "source_url": "https://huggingface.co/Qwen/Qwen3-0.6B",
      "confidence": "vendor_listed"
    },
    {
      "model_id": "openai-community/gpt2",
      "pipeline_tag": "text-generation",
      "downloads": 7605873,
      "likes": 3113,
      "license": "mit",
      "context_length": null,
      "size_bucket": "other",
      "private": false,
      "gated": false,
      "tags": [
        "transformers",
        "pytorch",
        "tf",
        "jax",
        "tflite",
        "rust",
        "onnx",
        "safetensors",
        "gpt2",
        "text-generation",
        "exbert",
        "en",
        "doi:10.57967/hf/0039",
        "license:mit",
        "text-generation-inference",
        "endpoints_compatible",
        "deploy:azure",
        "region:us"
      ],
      "last_modified": "2024-02-19T10:57:45.000Z",
      "source_url": "https://huggingface.co/openai-community/gpt2",
      "confidence": "vendor_listed"
    },
    {
      "model_id": "Qwen/Qwen2.5-3B-Instruct",
      "pipeline_tag": "text-generation",
      "downloads": 7385115,
      "likes": 404,
      "license": "other",
      "context_length": null,
      "size_bucket": "other",
      "private": false,
      "gated": false,
      "tags": [
        "transformers",
        "safetensors",
        "qwen2",
        "text-generation",
        "chat",
        "conversational",
        "en",
        "arxiv:2407.10671",
        "base_model:Qwen/Qwen2.5-3B",
        "base_model:finetune:Qwen/Qwen2.5-3B",
        "license:other",
        "text-generation-inference",
        "endpoints_compatible",
        "deploy:azure",
        "region:us"
      ],
      "last_modified": "2024-09-25T12:33:00.000Z",
      "source_url": "https://huggingface.co/Qwen/Qwen2.5-3B-Instruct",
      "confidence": "vendor_listed"
    },
    {
      "model_id": "Qwen/Qwen2.5-1.5B-Instruct",
      "pipeline_tag": "text-generation",
      "downloads": 6748326,
      "likes": 616,
      "license": "apache-2.0",
      "context_length": null,
      "size_bucket": "other",
      "private": false,
      "gated": false,
      "tags": [
        "transformers",
        "safetensors",
        "qwen2",
        "text-generation",
        "chat",
        "conversational",
        "en",
        "arxiv:2407.10671",
        "base_model:Qwen/Qwen2.5-1.5B",
        "base_model:finetune:Qwen/Qwen2.5-1.5B",
        "license:apache-2.0",
        "text-generation-inference",
        "endpoints_compatible",
        "deploy:azure",
        "region:us"
      ],
      "last_modified": "2024-09-25T12:32:50.000Z",
      "source_url": "https://huggingface.co/Qwen/Qwen2.5-1.5B-Instruct",
      "confidence": "vendor_listed"
    },
    {
      "model_id": "meta-llama/Llama-3.1-8B-Instruct",
      "pipeline_tag": "text-generation",
      "downloads": 5633386,
      "likes": 5455,
      "license": "llama3.1",
      "context_length": null,
      "size_bucket": "7b",
      "private": false,
      "gated": true,
      "tags": [
        "transformers",
        "safetensors",
        "llama",
        "text-generation",
        "facebook",
        "meta",
        "pytorch",
        "llama-3",
        "conversational",
        "en",
        "de",
        "fr",
        "it",
        "pt",
        "hi",
        "es",
        "th",
        "arxiv:2204.05149",
        "base_model:meta-llama/Llama-3.1-8B",
        "base_model:finetune:meta-llama/Llama-3.1-8B",
        "license:llama3.1",
        "eval-results",
        "text-generation-inference",
        "endpoints_compatible",
        "region:us"
      ],
      "last_modified": "2024-09-25T17:00:57.000Z",
      "source_url": "https://huggingface.co/meta-llama/Llama-3.1-8B-Instruct",
      "confidence": "vendor_listed"
    },
    {
      "model_id": "openai/gpt-oss-20b",
      "pipeline_tag": "text-generation",
      "downloads": 5486839,
      "likes": 4362,
      "license": "apache-2.0",
      "context_length": null,
      "size_bucket": "other",
      "private": false,
      "gated": false,
      "tags": [
        "transformers",
        "safetensors",
        "gpt_oss",
        "text-generation",
        "vllm",
        "conversational",
        "arxiv:2508.10925",
        "license:apache-2.0",
        "endpoints_compatible",
        "8-bit",
        "mxfp4",
        "deploy:azure",
        "region:us"
      ],
      "last_modified": "2025-08-26T17:25:47.000Z",
      "source_url": "https://huggingface.co/openai/gpt-oss-20b",
      "confidence": "vendor_listed"
    },
    {
      "model_id": "Qwen/Qwen2.5-0.5B-Instruct",
      "pipeline_tag": "text-generation",
      "downloads": 5214633,
      "likes": 462,
      "license": "apache-2.0",
      "context_length": null,
      "size_bucket": "other",
      "private": false,
      "gated": false,
      "tags": [
        "transformers",
        "safetensors",
        "qwen2",
        "text-generation",
        "chat",
        "conversational",
        "en",
        "arxiv:2407.10671",
        "base_model:Qwen/Qwen2.5-0.5B",
        "base_model:finetune:Qwen/Qwen2.5-0.5B",
        "license:apache-2.0",
        "text-generation-inference",
        "endpoints_compatible",
        "deploy:azure",
        "region:us"
      ],
      "last_modified": "2024-09-25T12:32:56.000Z",
      "source_url": "https://huggingface.co/Qwen/Qwen2.5-0.5B-Instruct",
      "confidence": "vendor_listed"
    },
    {
      "model_id": "Qwen/Qwen3-4B",
      "pipeline_tag": "text-generation",
      "downloads": 5090184,
      "likes": 552,
      "license": "apache-2.0",
      "context_length": null,
      "size_bucket": "other",
      "private": false,
      "gated": false,
      "tags": [
        "transformers",
        "safetensors",
        "qwen3",
        "text-generation",
        "conversational",
        "arxiv:2309.00071",
        "arxiv:2505.09388",
        "base_model:Qwen/Qwen3-4B-Base",
        "base_model:finetune:Qwen/Qwen3-4B-Base",
        "license:apache-2.0",
        "text-generation-inference",
        "endpoints_compatible",
        "region:us"
      ],
      "last_modified": "2025-07-26T03:46:39.000Z",
      "source_url": "https://huggingface.co/Qwen/Qwen3-4B",
      "confidence": "vendor_listed"
    },
    {
      "model_id": "Qwen/Qwen3-8B",
      "pipeline_tag": "text-generation",
      "downloads": 4642058,
      "likes": 934,
      "license": "apache-2.0",
      "context_length": null,
      "size_bucket": "7b",
      "private": false,
      "gated": false,
      "tags": [
        "transformers",
        "safetensors",
        "qwen3",
        "text-generation",
        "conversational",
        "arxiv:2309.00071",
        "arxiv:2505.09388",
        "base_model:Qwen/Qwen3-8B-Base",
        "base_model:finetune:Qwen/Qwen3-8B-Base",
        "license:apache-2.0",
        "text-generation-inference",
        "endpoints_compatible",
        "deploy:azure",
        "region:us"
      ],
      "last_modified": "2025-07-26T03:49:13.000Z",
      "source_url": "https://huggingface.co/Qwen/Qwen3-8B",
      "confidence": "vendor_listed"
    },
    {
      "model_id": "Qwen/Qwen2.5-32B-Instruct",
      "pipeline_tag": "text-generation",
      "downloads": 4369323,
      "likes": 327,
      "license": "apache-2.0",
      "context_length": null,
      "size_bucket": "34b",
      "private": false,
      "gated": false,
      "tags": [
        "transformers",
        "safetensors",
        "qwen2",
        "text-generation",
        "chat",
        "conversational",
        "en",
        "arxiv:2309.00071",
        "arxiv:2407.10671",
        "base_model:Qwen/Qwen2.5-32B",
        "base_model:finetune:Qwen/Qwen2.5-32B",
        "license:apache-2.0",
        "text-generation-inference",
        "endpoints_compatible",
        "deploy:azure",
        "region:us"
      ],
      "last_modified": "2024-09-25T12:33:09.000Z",
      "source_url": "https://huggingface.co/Qwen/Qwen2.5-32B-Instruct",
      "confidence": "vendor_listed"
    },
    {
      "model_id": "facebook/opt-125m",
      "pipeline_tag": "text-generation",
      "downloads": 4234362,
      "likes": 233,
      "license": "other",
      "context_length": null,
      "size_bucket": "other",
      "private": false,